{
  "$schema": "https://json-schema.org/draft/2020-12/schema",
  "$id": "https://raw.githubusercontent.com/api-evangelist/amazon-secrets-manager/refs/heads/main/json-schema/amazon-secrets-manager-secret-value-schema.json",
  "title": "SecretValue",
  "description": "SecretValue schema from Amazon Secrets Manager API",
  "type": "object",
  "properties": {
    "ARN": {
      "type": "string",
      "description": "The ARN of the secret."
    },
    "Name": {
      "type": "string",
      "description": "The friendly name of the secret."
    },
    "VersionId": {
      "type": "string",
      "description": "The unique identifier of this version of the secret."
    },
    "SecretBinary": {
      "type": "string",
      "format": "byte",
      "description": "The decrypted secret value in binary format."
    },
    "SecretString": {
      "type": "string",
      "description": "The decrypted secret value in string format."
    },
    "VersionStages": {
      "type": "array",
      "items": {
        "type": "string"
      },
      "description": "A list of the staging labels that are attached to this version."
    },
    "CreatedDate": {
      "type": "string",
      "format": "date-time",
      "description": "The date and time that this version of the secret was created."
    }
  }
}