{
  "ARN": "arn:aws:secretsmanager:us-east-1:123456789012:secret:MySecret-a1b2c3",
  "Name": "MyDatabaseSecret",
  "VersionId": "a1b2c3d4-e5f6-7890-abcd-ef1234567890",
  "SecretBinary": "MySecretValue123",
  "SecretString": "MySecretValue123",
  "VersionStages": [],
  "CreatedDate": "2025-03-15T14:30:00Z"
}